,repo_name,repo_owner,git_url,description,size,watchers_count,forks_count,open_issues
700,LETFT,PengLiPK,https://github.com/PengLiPK/LETFT,A software about 3D local earthquake tomography with full topography. The outputs are 3D P- and S-wave velocity model.,22859,9,4,0
701,uncertainties,ramos,https://github.com/ramos/uncertainties,Fortran MODULE for linear propagation of errors,10,9,1,0
702,wien2wannier,wien2wannier,https://github.com/wien2wannier/wien2wannier,from linearized augmented plane waves to maximally localized Wannier functions,4448,9,6,5
703,IHPCSS_Coding_challenge_2019,capellil,https://github.com/capellil/IHPCSS_Coding_challenge_2019,The repository containing everything you need to compete in the IHPCSS 2019 programming challenge.,1192,9,10,0
704,carlson-elliptic-integrals,jacobwilliams,https://github.com/jacobwilliams/carlson-elliptic-integrals,Carlson symmetric forms of elliptic integrals,604,9,1,0
705,NS-2D,hangsz,https://github.com/hangsz/NS-2D,Function Test for NS-2D Solver.,101407,9,12,0
706,hazel2,aasensio,https://github.com/aasensio/hazel2,Hazel v2.0: synthesis and inversion of Stokes profiles caused by the joint action of atomic level polarization and the Hanle and Zeeman effects,51686,9,2,7
707,periodic-NBO,jrschmidt2,https://github.com/jrschmidt2/periodic-NBO,,172,9,8,1
708,exchanges,dkorotin,https://github.com/dkorotin/exchanges,Exchange parameters of Heisenberg model calculation via Green's function approach,6630,9,4,0
709,Fortran---CGAL-polyhedra,LadaF,https://github.com/LadaF/Fortran---CGAL-polyhedra,Fortran bindings to the CGAL library to query whether a point is inside of a polyhedron and their distance.,264,8,3,1
710,Multigrid_Poisson_Solver_3D,phquanta,https://github.com/phquanta/Multigrid_Poisson_Solver_3D,3D Parallel(MPI)  Multigrid Poisson Solver,9,8,1,0
711,fortranString,bceverly,https://github.com/bceverly/fortranString,String class in Fortran 2008,32,8,0,1
712,fortran-sdl2,interkosmos,https://github.com/interkosmos/fortran-sdl2,Interfaces to SDL 2.0 for Fortran 2008,1912,8,0,0
713,mineos,geodynamics,https://github.com/geodynamics/mineos,Mineos computes synthetic seismograms in a spherically symmetric non-rotating Earth by summing normal modes.,77757,8,16,6
714,fortran-string,dongli,https://github.com/dongli/fortran-string,A readable Fortran string module,19,8,2,0
715,advanced-parallel-prog,csc-training,https://github.com/csc-training/advanced-parallel-prog,Advanced Parallel Programming,4238,8,5,0
716,fv3atm,NOAA-EMC,https://github.com/NOAA-EMC/fv3atm,,6779,8,42,17
717,gees,Azrael3000,https://github.com/Azrael3000/gees,GPL Euler equation solver,36,8,5,4
718,ode-openacc,starkiller-astro,https://github.com/starkiller-astro/ode-openacc,Some tests about solving ODEs / reaction networks on GPUs using OpenACC,3037,8,3,0
719,clawpack-4.x,clawpack,https://github.com/clawpack/clawpack-4.x,The old svn repository from kingkong will move here for future development.,3218,8,8,2
720,isoft,cmacmackin,https://github.com/cmacmackin/isoft,ISOFT: Ice Shelf/Ocean Fluid- and Thermodynamics,16842,8,1,0
721,Grid2Grid,LHEEA,https://github.com/LHEEA/Grid2Grid,HOS Wrapper for C++/fortran CFD solvers,18871,8,8,1
722,dnad,joddlehod,https://github.com/joddlehod/dnad,A Dual Number Automatic Differentiation Module for Fortran,8,8,1,0
723,fortran-container,dongli,https://github.com/dongli/fortran-container,This repository contains some container data structure types for Fortran.,39,8,6,0
724,Cassandra,MaginnGroup,https://github.com/MaginnGroup/Cassandra,Cassandra is a Monte Carlo package to conduct atomistic simulations.,844656,8,4,19
725,Architect,albz,https://github.com/albz/Architect,a hybrid 2D code for plasma wakefield acceleration,501,8,5,0
726,octave-3.8.2-enable-64-ubuntu-14.04,calaba,https://github.com/calaba/octave-3.8.2-enable-64-ubuntu-14.04,Octave 3.8.2 compiled with --enable-64 (experimental switch) on 64-bit Ubuntu Linux Desktop 14.04 (and higher),90472,8,3,0
727,PyLocEQ,amir-allam,https://github.com/amir-allam/PyLocEQ,Earthquake location in python based on eikonal travel times in 3D velocity models,9557,8,5,0
728,ddPCM,filippolipparini,https://github.com/filippolipparini/ddPCM,A fast domain decomposition based implementation of the COSMO solvation model,9730,8,11,0
729,Unit,andreypudov,https://github.com/andreypudov/Unit,A unit testing library for Fortran,90,8,1,0
730,MORTIF,szaghi,https://github.com/szaghi/MORTIF,MORTon Indexer (Z-order) Fortran environment,1101,8,1,2
731,diffusion-map,wesbarnett,https://github.com/wesbarnett/diffusion-map,Comparison of principal components analysis with diffusion maps on toy data sets and a molecular simulation trajectory,50495,8,2,0
732,OSM2018,sischei,https://github.com/sischei/OSM2018,,88259,8,32,0
733,Reflection-Removal,bhaktipriya,https://github.com/bhaktipriya/Reflection-Removal,Reflection Removal using Ghosting Cueues and Patch Priors. Modelled as modeled as a half Quadratic Optimization Problem.,25202,8,3,0
734,nanofort,jshahbazi,https://github.com/jshahbazi/nanofort,Fortran bindings for the nanomsg sockets library,17,8,1,0
735,Fortran_Davidson,NLESC-JCER,https://github.com/NLESC-JCER/Fortran_Davidson,Davidson eigensolver implemented in Fortran,15221,8,2,6
736,quadrature-fortran,jacobwilliams,https://github.com/jacobwilliams/quadrature-fortran,Adaptive Gaussian Quadrature with Modern Fortran,24,8,0,0
737,IMPACT-Z,impact-lbl,https://github.com/impact-lbl/IMPACT-Z,For IMPACT-Z beam dynamics code users and developers,10907,8,6,1
738,dsmc,schuberm,https://github.com/schuberm/dsmc,monte carlo of heat conduction from nanoparticle,401,8,3,1
739,channel-f90,davecats,https://github.com/davecats/channel-f90,Direct Numerical Simulation of an incompressible turbulent channel flow (F90),35,8,5,0
740,pydirect,npinto,https://github.com/npinto/pydirect,Python wrapper to the DIRECT global optimization algorithm (forked from http://code.google.com/p/pydirect/source/browse),152,8,5,1
741,decwar,drforbin,https://github.com/drforbin/decwar,Historic decwar fortran IV code which has been modified to run on simh (standard tops10 system),584,8,1,1
742,SummerSchool2014,fomics,https://github.com/fomics/SummerSchool2014,CSCS-USI Summer School in Parallel Programming 2014,53249,8,11,0
743,libsparse,jvdp1,https://github.com/jvdp1/libsparse,,380,8,0,0
744,stock-prices,modern-fortran,https://github.com/modern-fortran/stock-prices,Analyzing stock prices with Fortran arrays,1200,8,0,0
745,FASMA-synthesis,MariaTsantaki,https://github.com/MariaTsantaki/FASMA-synthesis,Python code for stellar spectral analysis,52932,8,3,4
746,mheap,trifling,https://github.com/trifling/mheap,Modern Fortran implementation of the heap data structure,9,8,1,1
747,fortran-collections,bast,https://github.com/bast/fortran-collections,Got tired of Fortran not having high level containers.,7,8,1,0
748,DNN,Quiota,https://github.com/Quiota/DNN,Contains Deep Learning Code implemented on generic CPUs & Intel Xeon Phi Coprocessors,8443,8,8,0
749,f90getopt,haniibrahim,https://github.com/haniibrahim/f90getopt,getopt functionality (C-like command-line argument parsing) for Fortran 90,28,8,2,0
750,sixs,jgomezdans,https://github.com/jgomezdans/sixs,Python bindings for 6s. The 6S code is a basic RT code used for calculation of lookup tables in the MODIS atmospheric correction algorithm.,531,8,4,1
751,feasolver,luogyong,https://github.com/luogyong/feasolver,a finite element in geotechnical applications,3044,8,3,0
752,ConductionFEM,anak-fhv,https://github.com/anak-fhv/ConductionFEM,FEM code for conduction heat transfer using ICEM-CFD .msh files,2128,8,2,0
753,SIS2,NOAA-GFDL,https://github.com/NOAA-GFDL/SIS2,NOAA-GFDL's Sea Ice Simulator version 2,4969,8,29,10
754,snap,metno,https://github.com/metno/snap,Severe Nuclear Accident Programme,17023,8,2,1
755,FORbID,giacombum,https://github.com/giacombum/FORbID,Simple OOP Fortran Definite Integrals Solver,61,8,3,7
756,matlab,jacobwilliams,https://github.com/jacobwilliams/matlab,,272,8,1,0
757,Grid-generation,hangsz,https://github.com/hangsz/Grid-generation,,6964,8,9,0
758,GGI_TLM,ggiemr,https://github.com/ggiemr/GGI_TLM,Time Domain electromagnetic modelling based on the TLM technique,83329,8,2,0
759,partmc,compdyn,https://github.com/compdyn/partmc,Particle-resolved stochastic atmospheric aerosol model,169465,8,5,41
760,sfincs,landreman,https://github.com/landreman/sfincs,SFINCS: the Stellarator Fokker-Planck Iterative Neoclassical Conservative Solver,78579,8,7,1
761,cs498,rauhul,https://github.com/rauhul/cs498,Applied Machine Learning UIUC SP 2017,39730,8,3,0
762,HASTY,szaghi,https://github.com/szaghi/HASTY,HASh Table fortran container exploting coarraY,6562,8,0,5
763,ParaviewPlugins,jrper,https://github.com/jrper/ParaviewPlugins,My ParaView plug source code.,1247,8,3,0
764,gmsh-to-vtk-and-tecplot,truongd8593,https://github.com/truongd8593/gmsh-to-vtk-and-tecplot,Convert .msh mesh file (Quadrilateral) of gmsh to .vtk file and/or .dat tecplot file,1098,8,7,0
765,deSolve,cran,https://github.com/cran/deSolve,":exclamation: This is a read-only mirror of the CRAN R package repository.  deSolve — Solvers for Initial Value Problems of Differential Equations ('ODE', 'DAE', 'DDE'). Homepage: http://desolve.r-forge.r-project.org/  ",17724,8,2,0
766,fold2Bloch-VASP,rubel75,https://github.com/rubel75/fold2Bloch-VASP,Unfolding the band structure of a supercell obtained with VASP,451,8,8,0
767,fortran-submodule,scivision,https://github.com/scivision/fortran-submodule,Examples of modern Fortran 2008 submodule,82,8,2,1
768,GFC,DmitryLyakh,https://github.com/DmitryLyakh/GFC,,273,8,0,0
769,torontonian-sampling,XanaduAI,https://github.com/XanaduAI/torontonian-sampling," This repository contains the source code used to produce the results presented in the paper ""Classical benchmarking of Gaussian Boson Sampling on the Titan supercomputer"".",27,8,3,0
770,scsbz,tflovorn,https://github.com/tflovorn/scsbz,Mean-field self-consistent equations for slave-boson superconductivity.,127,8,9,1
771,MAOOAM,Climdyn,https://github.com/Climdyn/MAOOAM,"Lua, Fortran and Python implementations of MAOOAM: the Modular Arbitrary-Order Ocean-Atmosphere Model",10415,8,9,1
772,NLP-Sentence-Compression,kyeah,https://github.com/kyeah/NLP-Sentence-Compression,Paraphrasic Sentence Compression using Deep-Link Bilingual Phrase Alignments.,82928,8,3,0
773,Le_OOPFortran,iurisegtovich,https://github.com/iurisegtovich/Le_OOPFortran,Learning Object Oriented Programming in Fortran,158,8,1,2
774,quantum_scf,xiangyunbin,https://github.com/xiangyunbin/quantum_scf,,194,8,10,0
775,DIABLO,johnryantaylor,https://github.com/johnryantaylor/DIABLO,DNS In A Box...Laptop Optimized!,823,8,14,1
776,fortran-datetime,dongli,https://github.com/dongli/fortran-datetime,Another Fortran datetime library,67,8,4,1
777,ButterflyPACK,liuyangzhuan,https://github.com/liuyangzhuan/ButterflyPACK,,802483,8,1,2
778,relax,geodynamics,https://github.com/geodynamics/relax,Relax implements a semi-analytic Fourier-domain solver and equivalent body forces to compute quasi-static relaxation of stress perturbation.,88379,8,7,0
779,fregex,andreww,https://github.com/andreww/fregex,Regular expressions in Fortran,104,8,4,0
780,freeon,FreeON,https://github.com/FreeON/freeon,Linear Scaling Electronic Structure,113482,8,4,2
781,HORSES2D,juanmanzanero,https://github.com/juanmanzanero/HORSES2D,Two dimensional high-order spectral element method fluid dynamics solver,1250,8,3,0
782,HOMMEXX,E3SM-Project,https://github.com/E3SM-Project/HOMMEXX,Clone of ACME for CMDV-SE project to convert HOMME to C++,49767,8,0,57
783,euler2D-kfvs-Fortran2003,truongd8593,https://github.com/truongd8593/euler2D-kfvs-Fortran2003,"2D solver for Euler equations using kinetic flux vector splitting scheme, written in OOP F2003",1377,8,7,0
784,fortran-generics,certik,https://github.com/certik/fortran-generics,Use cases for Fortran generics,20,8,0,0
785,DMFTtools,aamaricci,https://github.com/aamaricci/DMFTtools,A collection of fortran modules and routines based on SciFortran used in my DMFT or CondMat numerical codes.,526,8,5,0
786,HANK,ikarib,https://github.com/ikarib/HANK,Replication of Heterogeneous Agent New Keynesian (HANK) model in MATLAB,4966,8,14,2
787,pycsd,anuesseler,https://github.com/anuesseler/pycsd,python interface for using lapack cosine-sine decomposition,164,8,0,0
788,whamp,irfu,https://github.com/irfu/whamp,WHAMP - Waves in Homogeneous Anisotropic Magnetized Plasma.,5908,8,5,0
789,Monte-Carlo-Radiation-Phd,lewisfish,https://github.com/lewisfish/Monte-Carlo-Radiation-Phd,Monte Carlo Radiation Transport code for biological tissues.,1690,8,1,0
790,MAIZSIM,ARS-CSGCL-DT,https://github.com/ARS-CSGCL-DT/MAIZSIM,Source code for maize or corn (Zea Mays) simulation model,103283,8,10,0
791,SMFAPAC,mickcollins,https://github.com/mickcollins/SMFAPAC,systematic molecular fragmentation by annihilation,9028,8,1,1
792,GMCORE,LASG-GAMIL,https://github.com/LASG-GAMIL/GMCORE,A dynamical core for solving geophysical fluid equations on the sphere,473,8,3,0
793,wrf,cloudruninc,https://github.com/cloudruninc/wrf,Weather Research and Forecasting (WRF) model,53042,8,0,0
794,fortranLAB,iurisegtovich,https://github.com/iurisegtovich/fortranLAB,"A collection of links, samples, examples and tests for setup and usage of fortran (or maybe c) with libraries providing number crunching capabilities like those of MATLAB",10827,8,0,1
795,homebrew-rocket-sim,stanford-ssi,https://github.com/stanford-ssi/homebrew-rocket-sim,SSI's very own rocket simulator program.,2092,8,2,0
796,MultiNest,rjw57,https://github.com/rjw57/MultiNest,MultiNest is a Bayesian inference tool which calculates the evidence and explores the parameter space which may contain multiple posterior modes and pronounced (curving) degeneracies in moderately high dimensions.,179,8,13,2
797,gabriel,jdonners,https://github.com/jdonners/gabriel,Fortran library to simplify the use of MPI for halo exchanges and transformations,310,8,0,5
798,lagrange_interpolator,jlokimlin,https://github.com/jlokimlin/lagrange_interpolator,An OOP library for 1 and 2-dimensional Lagrange interpolation,5,8,1,0
799,fortran-tutorial,cmacmackin,https://github.com/cmacmackin/fortran-tutorial,An introduction for programmers who have no experience with Fortran,320,8,6,0
800,specfem1d,geodynamics,https://github.com/geodynamics/specfem1d,SPECFEM1D simulates seismic wave propagation in a one-dimensional heterogeneous medium. It is a small code that allows users to learn how a spectral-element program is written.,117,8,16,0
801,yajl-fort,nncarlson,https://github.com/nncarlson/yajl-fort,YAJL-Fort:  A modern Fortran interface to the YAJL library,294,8,2,1
802,lineclipping-python-fortran,scivision,https://github.com/scivision/lineclipping-python-fortran,"Line clipping in clean, simple, modern Fortran and Python",43,8,1,0
803,wrf-downscaling,ebimodeling,https://github.com/ebimodeling/wrf-downscaling,,133868,8,10,5
804,RF_INV,akuhara,https://github.com/akuhara/RF_INV,Receiver function inversion by reversible-jump Markov-chain Monte Carlo,3863,8,4,2
805,moog,andycasey,https://github.com/andycasey/moog,A package installer for the MOOG code,1894,8,10,5
806,SimpleMAC,jonkomperda,https://github.com/jonkomperda/SimpleMAC,"SimpleMAC is a marker and call method CFD (computational fluid dynamics) solver. It was originally developed for a graduate supercomputing course, and is now being released and updated for further use.",9156,8,0,1
807,Non-Reflecting-Boundary-Conditions-NRBC,hlalit,https://github.com/hlalit/Non-Reflecting-Boundary-Conditions-NRBC,"Implemented the non-reflecting boundary conditions of Poinsot and Lele, JCP 1992 with Fortran. Input files have been provided Validation has been done using a subsonic compressible channel flow test case second order spatial differencing has been used and 4th order Runge Kutta scheme for time advancement Compressible finite difference solver implemented",11,8,2,1
808,UQTk,sandialabs,https://github.com/sandialabs/UQTk,Sandia Uncertainty Quantification Toolkit,17154,8,3,0
809,cfd,sAlexander,https://github.com/sAlexander/cfd,2d CFD solves the incompressible Euler equations. Code written in Fortran,168,7,2,0
810,Fortran-Utilities,apmccartney,https://github.com/apmccartney/Fortran-Utilities,a small collection of utilities written in fortran 2008 in an object-oriented style.,124,7,0,0
811,mplabs,carlosrosales,https://github.com/carlosrosales/mplabs,Multiphase Lattice Boltzmann Suite,3640,7,8,0
812,nodalDG,lightd22,https://github.com/lightd22/nodalDG,Nodal discontinuous Galerkin methods,188,7,7,0
813,py_interp,markelg,https://github.com/markelg/py_interp,"Command line tool for interpolating WRF output files to pressure levels, as well as computing a series of diagnostics such as low, medium and high cloud cover.",200,7,2,0
814,slicot,KTH-AC,https://github.com/KTH-AC/slicot,SLICOT: Subroutine Library in Systems and Control Theory,2911,7,3,1
815,PsrPopPy,samb8s,https://github.com/samb8s/PsrPopPy,"Python implementation of PSRPOP, designed to be run from the command line or from Python scripts/interpreter",4632,7,20,0
816,Perplex,davehirsch,https://github.com/davehirsch/Perplex,"A cross-platform thermodynamics program for geologists, written in Fortran and C",6760,7,2,0
817,DSHARK,pastfalk,https://github.com/pastfalk/DSHARK,,70,7,3,0
818,ffr-PWDFT,f-fathurrahman,https://github.com/f-fathurrahman/ffr-PWDFT,A poor man's density functional theory program,184,7,2,0
819,Fortran-OpenPMD-File-Writers,UCLA-Plasma-Simulation-Group,https://github.com/UCLA-Plasma-Simulation-Group/Fortran-OpenPMD-File-Writers,Fortran 2003 Parallel HDF5 File Writers and Readers in OpenPMD Standard,14,7,4,0
820,en600.468,alopez,https://github.com/alopez/en600.468,Assignments for mt-class.org/jhu,16164,7,12,0
821,GIEM2G,DarthLaran,https://github.com/DarthLaran/GIEM2G,Gnu Integral Equation Modeling in ElectroMagnetic  Geophysics ,5493,7,2,0
822,benchio,EPCCed,https://github.com/EPCCed/benchio,EPCC I/O benchmarking applications,60,7,1,4
823,q-e_schrodinger,QEF,https://github.com/QEF/q-e_schrodinger,Quantum ESPRESSO package for integration into Schrödinger’s Materials Science Suite,401905,7,5,1
824,pyhelp,cgq-qgc,https://github.com/cgq-qgc/pyhelp,A Python library for the assessment of spatially distributed groundwater recharge and hydrological components with HELP,21971,7,3,11
825,autoderiv,s1291,https://github.com/s1291/autoderiv,Automatic differentiation example,19,7,1,0
826,libSUFR,MarcvdSluys,https://github.com/MarcvdSluys/libSUFR,ibSUFR is a library containing Some Useful Fortran Routines,722,7,4,0
827,python-helmholtz,jschwab,https://github.com/jschwab/python-helmholtz,Python bindings for Frank Timmes' Helmholtz equation of state,22452,7,5,0
828,librmn,armnlib,https://github.com/armnlib/librmn,Collection of routines for numerical weather prediction,2217,7,2,0
829,sexptran,berke,https://github.com/berke/sexptran,Fortran library for reading and writing S-expressions,37,7,0,0
830,MPI_Practicals_Solutions,themisa,https://github.com/themisa/MPI_Practicals_Solutions,Solutions for the MPI Practicals for Summer School 2014,72,7,1,0
831,py2f,rjfarmer,https://github.com/rjfarmer/py2f,embed pyton in fortran code,42,7,1,0
832,postlammps,atoms-ufrj,https://github.com/atoms-ufrj/postlammps,A tool for performing post-processing of lammps log files,334,7,3,0
833,morton_fortran,jannisteunissen,https://github.com/jannisteunissen/morton_fortran,Convert between regular and Morton indices in 2D and 3D,20,7,0,0
834,gfortran.dg,nncarlson,https://github.com/nncarlson/gfortran.dg,The GFortran testsuite rigged for testing other Fortran compilers,2770,7,2,13
835,MC3deconv,akuhara,https://github.com/akuhara/MC3deconv,Bayeisan inversion to recover Green's functions of receiver-side structures from teleseismic waveforms,4023,7,2,0
836,flib,crshapiro,https://github.com/crshapiro/flib,A Fortran Library,122,7,0,0
837,fishpack,jlokimlin,https://github.com/jlokimlin/fishpack,Implements the generalized Buneman algorithm to solve separable elliptic partial differential equations.,2200,7,4,5
838,Coding-Examples,srinathv,https://github.com/srinathv/Coding-Examples,Organize test codes for all languages,10680,7,2,0
839,Dynamical-Systems-Toolbox-V2,ecoetzee,https://github.com/ecoetzee/Dynamical-Systems-Toolbox-V2,Matlab integration of AUTO for dynamical systems analysis,13953,7,4,0
840,RALFit,ralna,https://github.com/ralna/RALFit,A non-linear least squares solver,2942,7,4,30
841,fume,dongli,https://github.com/dongli/fume,Fluid Universal Modeling Environment,16,7,0,0
842,Fortran-Library-for-Material-Constitutive-Models,jenovencio,https://github.com/jenovencio/Fortran-Library-for-Material-Constitutive-Models,"This library has a lot of Fortran Routines for model implicit material constitutive behavior. There are implementation of Neo-Hooken, Odgen and Hencky potential for hyperelastic behavior.",7765,7,6,0
843,chimera2castro,ECP-Astro,https://github.com/ECP-Astro/chimera2castro,,335,7,5,1
844,fortran-regex,dongli,https://github.com/dongli/fortran-regex,A regex implementation in pure Fortran.,3,7,1,0
845,NHDS,danielver02,https://github.com/danielver02/NHDS,The New Hampshire Dispersion relation Solver,322,7,4,0
846,nc4fortran,scivision,https://github.com/scivision/nc4fortran,"Object-oriented interface for NetCDF4 in Fortran, like h5fortran (HDF5)",105,7,0,0
847,paramonte,cdslaborg,https://github.com/cdslaborg/paramonte,ParaMonte: Plain Powerful Parallel Monte Carlo Library,1409,7,0,0
848,tests-uh,openshmem-org,https://github.com/openshmem-org/tests-uh,OpenSHMEM Test Suite,2361,7,15,2
849,icatt-2016,helgee,https://github.com/helgee/icatt-2016,"Supplementary materials for ""A Comparative Study Of Programming Languages for Next-Generations Astrodynamics Systems""",201,7,2,2
850,RGP-Gen,everhusk,https://github.com/everhusk/RGP-Gen,Real Gas Property File Generator for ANSYS CFX V14.5,590,7,8,3
851,NoahMP,ESMWG,https://github.com/ESMWG/NoahMP,The Noah with multiparameterization options (NoahMP) land surface model ,308,7,7,0
852,hdf5-tutorial,kmanalo,https://github.com/kmanalo/hdf5-tutorial,,232,7,0,0
853,hdf5_interface,fccf,https://github.com/fccf/hdf5_interface,high level  fortran interface for HDF5,152,7,2,0
854,RIKsrf,fgallovic,https://github.com/fgallovic/RIKsrf,RIK earthquake source model: Slip rate generator,4046,7,3,1
855,KTH_Toolbox,KTH-Nek5000,https://github.com/KTH-Nek5000/KTH_Toolbox,,1605,7,8,1
856,SIMPLE3.0,hael,https://github.com/hael/SIMPLE3.0,A new repository(with deleted history) in preparation for release 3.0 of SIMPLE,451363,7,1,0
857,RMPCDMD,pdebuyl-lab,https://github.com/pdebuyl-lab/RMPCDMD,Code to perform chemical MPCD simulations,1247,7,2,0
858,PPM_RC,yafshar,https://github.com/yafshar/PPM_RC,2D-3D distributed parallel Region Competition segmentation algorithm,730,7,1,0
859,lbfgsb-sys,noshu,https://github.com/noshu/lbfgsb-sys,Rust binding of fortran Limited memory LBFGS subroutine,51,7,2,2
860,quantreg,cran,https://github.com/cran/quantreg,:exclamation: This is a read-only mirror of the CRAN R package repository.  quantreg — Quantile Regression. Homepage: https://www.r-project.org  ,3746,7,6,0
861,qmd-progress,lanl,https://github.com/lanl/qmd-progress,"PROGRESS: Parallel, Rapid O(N) and Graph-based Recursive Electronic Structure Solver.",127797,7,8,9
862,generics,sourceryinstitute,https://github.com/sourceryinstitute/generics,,42,7,1,1
863,gibbs2,aoterodelaroza,https://github.com/aoterodelaroza/gibbs2,Thermodynamics of solids in the quasiharmonic approximation.,8845,7,2,0
864,mt3d-usgs,MODFLOW-USGS,https://github.com/MODFLOW-USGS/mt3d-usgs,MT3D-USGS Repository,49017,7,9,6
865,GenASiS_Basics,GenASiS,https://github.com/GenASiS/GenASiS_Basics,Object-oriented Utilitarian Functionality for Large-scale Physics Simulations ,391,7,0,0
866,euler2d,cpraveen,https://github.com/cpraveen/euler2d,2-D inviscid flow and adjoint solver,336,7,11,0
867,pyboxlib,memmett,https://github.com/memmett/pyboxlib,Python BoxLib wrapper,124,7,0,0
868,leaks_hunter,szaghi,https://github.com/szaghi/leaks_hunter,hunter of Fortran Compilers memory leaks,24,7,0,0
869,linalg,jchristopherson,https://github.com/jchristopherson/linalg,A linear algebra library that provides a user-friendly interface to several BLAS and LAPACK routines.,5395,7,0,0
870,Nek5000,yhaomin2007,https://github.com/yhaomin2007/Nek5000,Nek5000 usr defined code and examples,46626,7,12,0
871,raytracer,edin,https://github.com/edin/raytracer,Performance comparison of various compilers,9478,7,0,0
872,nsc2ke,cpraveen,https://github.com/cpraveen/nsc2ke,Finite-Volume Galerkin program computing 2D and axisymmetric flows,1496,7,5,0
873,MPMD-with-Fortran-2008-Coarrays,MichaelSiehl,https://github.com/MichaelSiehl/MPMD-with-Fortran-2008-Coarrays,THIS REPOSITORY IS DEDICATED TO A PROGRAMMING STYLE THAT ALLOWS MPMD-LIKE PARALLEL PROGRAMMING USING FORTRAN 2008 COARRAYS (PGAS),656,7,0,0
874,single-linked-list,szaghi,https://github.com/szaghi/single-linked-list,,172,7,0,0
875,PyDQED,jwallen,https://github.com/jwallen/PyDQED,A Python wrapper for the DQED constrained nonlinear optimization code,221,7,2,2
876,vsop87,ctdk,https://github.com/ctdk/vsop87,VSOP87 files,8346,7,8,0
877,PLMC,fortranguy,https://github.com/fortranguy/PLMC,A simple Physics of Liquids Monte Carlo simulation code written in Fortran,26416,7,0,0
878,pscf,dmorse,https://github.com/dmorse/pscf,Polymer self-consistent field theory (Fortran version),4344,7,13,2
879,Pecube-HUGG,HUGG,https://github.com/HUGG/Pecube-HUGG,This repository is for the Helsinki University Geodynamics Group (HUGG) version of Pecube.,5406,7,2,1
