,repo_name,repo_owner,git_url,description,size,watchers_count,forks_count,open_issues
347,GARD,NCAR,https://github.com/NCAR/GARD,Generalized Analog Regression Downscaling (GARD) code,542,16,12,19
348,splash,danieljprice,https://github.com/danieljprice/splash,,7503,16,9,13
349,CB-Fortran-Color-Theme,kookma,https://github.com/kookma/CB-Fortran-Color-Theme,Code Blocks color theme for Fortran language ,676,16,0,0
350,dop853,jacobwilliams,https://github.com/jacobwilliams/dop853,Modern Fortran Edition of Hairer's DOP853 ODE Solver,848,16,4,1
351,adjac,pv,https://github.com/pv/adjac,Automatic Differentiation (1st order) for Fortran 95,209,16,3,0
352,fortran-guidelines,ebranlard,https://github.com/ebranlard/fortran-guidelines,Guidelines for programming in fortran,454,16,2,0
353,gFTL,nasa,https://github.com/nasa/gFTL,,137,16,8,0
354,ZOO,szaghi,https://github.com/szaghi/ZOO,"ZOO, Zaghi fOrtran cOllection, where my wild Fortran pets will survive",387,16,2,1
355,UPIC-2.0,UCLA-Plasma-Simulation-Group,https://github.com/UCLA-Plasma-Simulation-Group/UPIC-2.0,Framework of trusted components for building and customizing parallel particle-in-cell codes for plasma simulation.,4033,16,14,0
356,LibForQ,jonasmaziero,https://github.com/jonasmaziero/LibForQ,A Fortran Library for Quantum Information Science,418,16,2,0
357,SeismicPackage,gitzhzhg,https://github.com/gitzhzhg/SeismicPackage,Open source seismic packages collected from varieties of websites,267528,15,12,0
358,fortran-error-handler,samharrison7,https://github.com/samharrison7/fortran-error-handler,"Comprehensive error framework for applications requiring functional and robust error handling, utilising the power of modern object-oriented Fortran.",326,15,0,1
359,zen-of-fortran-talk,szaghi,https://github.com/szaghi/zen-of-fortran-talk,"a path to discover Modern Fortran, a poor, informal talk for newbies Fortraners",1209,15,4,0
360,GR1D,evanoconnor,https://github.com/evanoconnor/GR1D,"General Relativistic, Spherically Symmetry, Neutrino Transport Code for Stellar Collapse",661,15,7,3
361,ddeabm,jacobwilliams,https://github.com/jacobwilliams/ddeabm,Modern Fortran implementation of the DDEABM Adams-Bashforth algorithm,2355,15,3,1
362,FUPRAL,RBCanelas,https://github.com/RBCanelas/FUPRAL,Fortran OO implementation of a generic container using an unlimited polymorphic class. Implementation of a resizable container array and a double linked list.,885,15,0,0
363,CROCO-NH,ducousso,https://github.com/ducousso/CROCO-NH,a non-hydrostatic incompressible ocean model based on CROCO,31060,15,4,0
364,L-BFGS-ocaml,Chris00,https://github.com/Chris00/L-BFGS-ocaml,OCaml bindings for L-BFGS,198,15,2,0
365,MeshTools,su2code,https://github.com/su2code/MeshTools,Mesh tools for SU2,1324,15,14,0
366,fortran-search-and-sort,jacobwilliams,https://github.com/jacobwilliams/fortran-search-and-sort,Searching and sorting with modern Fortran,13,15,1,0
367,libmbd,jhrmnn,https://github.com/jhrmnn/libmbd,Many-body dispersion library,3097,15,6,5
368,GEMINI,gemini3d,https://github.com/gemini3d/GEMINI,public repo for ionospheric fluid electrodynamic model,11544,15,4,1
369,example-fortran,codecov,https://github.com/codecov/example-fortran,Example repo for uploading reports to Codecov,45,15,7,0
370,EFDC-MPI,fearghalodonncha,https://github.com/fearghalodonncha/EFDC-MPI,MPI parallel version of the popular Environmental Fluid Dynamics Code (EFDC),29366,15,7,0
371,DIVA,gher-ulg,https://github.com/gher-ulg/DIVA,DIVA (Data-Interpolating Variational Analysis) is a software tool dedicated to the spatial interpolation of in situ data in oceanography.,39196,15,3,2
372,MUMPSjInv.jl,JuliaInv,https://github.com/JuliaInv/MUMPSjInv.jl,MUMPS interface for Julia,9486,15,15,9
373,unfold,unfoldtoolbox,https://github.com/unfoldtoolbox/unfold,A matlab EEG toolbox to perform overlap correction and non-linear & linear regression.,33522,15,3,30
374,KGen,NCAR,https://github.com/NCAR/KGen,Fortran Kernel Generator,11594,15,12,36
375,GHOST,pmininni,https://github.com/pmininni/GHOST,GHOST (the Geophysical High-Order Suite for Turbulence) is an accurate and highly scalable pseudospectral code that solves a variety of PDEs often encountered in studies of turbulent flows.,1498,15,6,0
376,BeFoR64,szaghi,https://github.com/szaghi/BeFoR64,"BeFoR64, Base64 encoding/decoding library for FoRtran poor men",1802,15,9,2
377,dqmc_demo,wanderxu,https://github.com/wanderxu/dqmc_demo,,301,15,5,0
378,WABBIT,adaptive-cfd,https://github.com/adaptive-cfd/WABBIT,Wavelet Adaptive Block-Based solver for Interactions with Turbulence,15659,15,14,17
379,nap,ryokbys,https://github.com/ryokbys/nap,Nagoya Atomistic-simulation Package (NAP). Why don't you take a NAP? ;),10747,15,2,0
380,2D_CARFIVE,dattv,https://github.com/dattv/2D_CARFIVE,2D Cartesian Quadtree Adaptive Mesh Refinement (AMR) for multiphase Five Equations Model ,46,15,9,0
381,workfunction,WMD-group,https://github.com/WMD-group/workfunction,Calculate the planar averaged electrostatic potential for the density functional theory code VASP (Version 5 compatible),30994,15,8,0
382,cpu_timer,jlokimlin,https://github.com/jlokimlin/cpu_timer,A computational tool to benchmark large-scale simulations.,85,15,1,1
383,fiona,dongli,https://github.com/dongli/fiona,Fortran IO Netcdf Assembly,87,15,3,0
384,PSU_WRF_EnKF,myying,https://github.com/myying/PSU_WRF_EnKF,,668,15,20,0
385,specfem3d_geotech,geodynamics,https://github.com/geodynamics/specfem3d_geotech,SPECFEM3D_GEOTECH is an open-source command-driven software for 3D slope stability analysis and simulation of 3D multistage excavation based on the spectral-element method.,19634,15,10,3
386,octree-mg,jannisteunissen,https://github.com/jannisteunissen/octree-mg,MPI geometric multigrid solver for quadtree/octree grids,642,14,3,0
387,tetran,fortran-gaming,https://github.com/fortran-gaming/tetran,"Falling-block object-oriented Fortran 2018 game, resizable playfield",1184,14,1,0
388,fosolvers,mianzhi,https://github.com/mianzhi/fosolvers,FOSolverS: a Suite of Free & Open Source Solvers. A brief overview: ,3699,14,4,3
389,fluxo,project-fluxo,https://github.com/project-fluxo/fluxo,Fluxo implements the DGSEM for general advection-diffusion equations,1106,14,8,0
390,glmnet,jeffwong,https://github.com/jeffwong/glmnet,R package glmnet for estimating lasso and elastic net,793,14,19,8
391,landslides-trigrs,usgs,https://github.com/usgs/landslides-trigrs,,286,14,14,2
392,romstools,trondkr,https://github.com/trondkr/romstools,A variety of tools for plotting and analysing output from the Regional Ocean Model (ROMS),11801,14,6,0
393,HPC-Phase_Field,Marsfish1981,https://github.com/Marsfish1981/HPC-Phase_Field,This is a software package for simulation of micro-structure evolution using phase field model,2381,14,6,0
394,MFC-Caltech,ComputationalFlowPhysics,https://github.com/ComputationalFlowPhysics/MFC-Caltech,High-fidelity multiphase flow simulation,21611,14,5,0
395,MiMA,mjucker,https://github.com/mjucker/MiMA,Model of an idealized Moist Atmosphere: Intermediate-complexity General Circulation Model with full radiation,16938,14,7,0
396,Hefei-NAMD,QijingZheng,https://github.com/QijingZheng/Hefei-NAMD, ab-initio nonadiabatic molecular dynamics program,1510,14,12,1
397,tetran,lewisjb,https://github.com/lewisjb/tetran,Tetris-style game written in FORTRAN-95,19,14,1,0
398,FARLib,Sbai7,https://github.com/Sbai7/FARLib,Fortran Array collection library,35,14,0,0
399,mpifx,dftbplus,https://github.com/dftbplus/mpifx,Modern Fortran wrappers around MPI routines,192,14,7,4
400,Fortran-utilities,NECP-XJTU,https://github.com/NECP-XJTU/Fortran-utilities,"It is a FORTRAN utilities library, which is to help the FORTRAN developers to put more efforts on the physics software development.",129,14,0,0
401,apexpy,aburrell,https://github.com/aburrell/apexpy,A Python wrapper for Apex coordinates,525,14,7,7
402,Q6,qusers,https://github.com/qusers/Q6,"Q6 Repository -- EVB, FEP and LIE simulator.",35526,14,6,8
403,HDF5_utils,tiasus,https://github.com/tiasus/HDF5_utils,my own Fortran high level interface for HDF5,85,14,2,1
404,IM2ODE,YueyuZhang,https://github.com/YueyuZhang/IM2ODE,Inverse Design of Materials by Multi-objective Differential Evolution,549,14,4,0
405,overkit-fortran,majosm,https://github.com/majosm/overkit-fortran,Open source overset grid assembly and remapping toolkit (old Fortran version),1073,14,5,0
406,orac,ORAC-CC,https://github.com/ORAC-CC/orac,Optimal Retrieval of Aerosol and Cloud,10400,14,7,13
407,call_py_fort,nbren12,https://github.com/nbren12/call_py_fort,Call python from fortran,17,14,1,4
408,SBDART,paulricchiazzi,https://github.com/paulricchiazzi/SBDART,Plane-parallel radiative transfer code based on DISORT and LOWTRAN band-models,2932,14,7,2
409,miniSMC,WeiqunZhang,https://github.com/WeiqunZhang/miniSMC,  DNS code solving compressible Navier-Stokes equations for viscous multi-component reacting flows,288,14,22,0
410,pysic,thynnine,https://github.com/thynnine/pysic,Python library for advanced atomistic simulations,18063,14,6,3
411,modflow-2005-upcg,jdhughes-usgs,https://github.com/jdhughes-usgs/modflow-2005-upcg,MODFLOW-2005 version 1.10 with the UPCG solver,48160,14,1,0
412,CVMix-src,CVMix,https://github.com/CVMix/CVMix-src,CVMix source code (including protex documentation) as well as build system and examples / tests,5259,14,22,21
413,py_gmm,gevero,https://github.com/gevero/py_gmm,"A Generalized Multiparticle Mie code, especially suited for plasmonics",9138,14,9,3
414,iso,aarondotter,https://github.com/aarondotter/iso,MESA isochrone code,694,14,4,2
415,mc_kernel,seismology,https://github.com/seismology/mc_kernel,Calculate seismic sensitivity kernels using Axisem,43667,14,7,14
416,ODEInterface.jl,luchr,https://github.com/luchr/ODEInterface.jl,julia package providing an interface for ODE-solvers written in Fortran,7562,14,9,4
417,FUNWAVE-TVD,fengyanshi,https://github.com/fengyanshi/FUNWAVE-TVD,,71006,14,26,5
418,shadow3,oasys-kit,https://github.com/oasys-kit/shadow3,Official repository for shadow3 (x-ray-tracer engine),4978,14,11,20
419,BasicDTUController,DTUWindEnergy,https://github.com/DTUWindEnergy/BasicDTUController,"This repository is no longer being updated, and has been moved to DTU Wind Energy's GitLab server: https://gitlab.windenergy.dtu.dk/OpenLAC/BasicDTUController",1320,14,23,10
420,ncio,alex-robinson,https://github.com/alex-robinson/ncio,Simple Fortran interface to NetCDF reading and writing.,878,14,4,5
421,rads,remkos,https://github.com/remkos/rads,Radar Altimeter Database System (RADS),11088,14,14,27
422,FortGL,lewisfish,https://github.com/lewisfish/FortGL,Software renderer in pure Fortran,1295,14,0,0
423,xfoil,RobotLocomotion,https://github.com/RobotLocomotion/xfoil,Fork of Mark Drela's XFOIL software (http://raphael.mit.edu/xfoil) which builds using cmake.,3975,14,6,1
424,scikits.bvp_solver,jsalvatier,https://github.com/jsalvatier/scikits.bvp_solver,Python package for solving two-point boundary value problems that wraps BVP_SOLVER,902,13,7,7
425,chimera,hightower8083,https://github.com/hightower8083/chimera,Fourier-Bessel Particle-In-Cell code,41357,13,2,0
426,ModeMap,JMSkelton,https://github.com/JMSkelton/ModeMap,A set of tools for mapping and analysing the potential-energy surfaces along phonon modes.,1021,13,9,0
427,FITTER,szaghi,https://github.com/szaghi/FITTER,Fortran tIc Toc Timer,45,13,1,1
428,wafo,wafo-project,https://github.com/wafo-project/wafo,Automatically exported from code.google.com/p/wafo,60715,13,8,8
429,tlab,turbulencia,https://github.com/turbulencia/tlab,,20541,13,13,0
430,dales,dalesteam,https://github.com/dalesteam/dales,Dutch Atmospheric Large-Eddy Simulation model,142712,13,19,31
431,FIDASIM,D3DEnergetic,https://github.com/D3DEnergetic/FIDASIM,A Neutral Beam and Fast-ion Diagnostic Modeling Suite,476252,13,8,7
432,flogging,Exteris,https://github.com/Exteris/flogging,A Fortran logging system with MPI support,537,13,2,0
433,gadfit,raullaasner,https://github.com/raullaasner/gadfit,Global nonlinear optimization with automatic differentiation,1754,13,2,0
434,Cosmos,UW-COSMOS,https://github.com/UW-COSMOS/Cosmos,Knowledge base construction from raw scientific documents,76265,13,7,11
435,COAWST,jcwarner-usgs,https://github.com/jcwarner-usgs/COAWST,This is a testing and development version. Not suitable for general distribution.,797563,13,24,0
436,spaceMARINE,kylekanos,https://github.com/kylekanos/spaceMARINE,Solves 2D/3D hydrodynamic problems in Eulerian framework on a Cartesian grid with Adaptive Mesh Refinement via the BoxLib library,200,13,3,0
437,fortran-unit-test,dongli,https://github.com/dongli/fortran-unit-test,Another Fortran unit test library,87,13,4,0
438,SCRIP,SCRIP-Project,https://github.com/SCRIP-Project/SCRIP,,1517,13,10,3
439,NuLib,evanoconnor,https://github.com/evanoconnor/NuLib,open-source neutrino interaction library,2282,13,11,8
440,faiNumber-Fortran,kevinhng86,https://github.com/kevinhng86/faiNumber-Fortran,"A fast, flexible, and secure numerical library for Fortran.",313,13,0,0
441,PyRADS,ddbkoll,https://github.com/ddbkoll/PyRADS,A line-by-line longwave radiation code for planetary atmospheres.,13991,13,2,3
442,hercules,friedenhe,https://github.com/friedenhe/hercules,"HERCULES: An open-source, massively parallel direct numerical simulation solver",5678,13,2,0
443,odepack,jacobwilliams,https://github.com/jacobwilliams/odepack,Unofficial Mirror of the ODEPACK Library,381,13,7,0
444,Mpi-IoC-HDF5-Fortran-CMake,rchuso,https://github.com/rchuso/Mpi-IoC-HDF5-Fortran-CMake,"Example of using Message Passing Interface and Inversion of Control with modern Fortran and HDF5, all built with CMake.",36,13,1,0
445,GridGen,Sbai7,https://github.com/Sbai7/GridGen,Command-line Grid Generation Program and much More,776,13,0,0
446,Empire-for-PDP-10,DigitalMars,https://github.com/DigitalMars/Empire-for-PDP-10,Empire for the PDP-10 in the FORTRAN-10 programming language,152,13,6,0
447,global_solution_yale19,sischei,https://github.com/sischei/global_solution_yale19,,61896,13,9,0
448,fortran-programming,hancockyang,https://github.com/hancockyang/fortran-programming,"It is FORTRAN programming practice for 'Walter S. Brainerd, Guide to Fortran 2008 Programming'",47,13,0,0
449,fArgParse,Goddard-Fortran-Ecosystem,https://github.com/Goddard-Fortran-Ecosystem/fArgParse,Command line argument parsing for Fortran,196,13,0,5
450,mo_netcdf,schaefed,https://github.com/schaefed/mo_netcdf,Modern fortran netcdf wrapper,82,13,2,0
451,COSMIC,COSMIC-PopSynth,https://github.com/COSMIC-PopSynth/COSMIC,COSMIC (Compact Object Synthesis and Monte Carlo Investigation Code),10162,13,25,27
452,Topo,NCAR,https://github.com/NCAR/Topo,NCAR Global Model Topography Generation Software for Unstructured Grids,2614236,13,8,0
453,DISCOVER,NKI-CCB,https://github.com/NKI-CCB/DISCOVER,DISCOVER co-occurrence and mutual exclusivity analysis for cancer genomics data,351,13,6,0
454,fortran-octree,dongli,https://github.com/dongli/fortran-octree,A Fortran octree implementation,20,13,4,0
455,eigenkernel,eigenkernel,https://github.com/eigenkernel/eigenkernel,EigenKernel - a package of hybrid parallel solvers for eigenvalue problems,229,13,1,2
456,iqist,huangli712,https://github.com/huangli712/iqist,Interacting Quantum Impurity Solver Toolkit,267796,13,3,1
457,SALMON,SALMON-TDDFT,https://github.com/SALMON-TDDFT/SALMON,Scientific program for first-principles electron dynamics calculations ,2728,13,16,5
458,CyGutz,yaoyongxin,https://github.com/yaoyongxin/CyGutz,A versatile Gutzwiller solver to optimize the single Slater determinant and local many-body degrees of freedom simultaneously within the Gutzwiller approximation or equivalently Slave-boson approach. ,232472,13,5,0
459,thermo_pw,dalcorso,https://github.com/dalcorso/thermo_pw,Ab-initio computation of material properties,22464,13,7,0
460,PROFESS,EACcodes,https://github.com/EACcodes/PROFESS,PRinceton Orbital-Free Electronic Structure Software,2782,13,10,0
461,nciplot,aoterodelaroza,https://github.com/aoterodelaroza/nciplot,Non-covalent index plots in molecular systems.,107727,13,2,0
462,xml-fortran,paulromano,https://github.com/paulromano/xml-fortran,XML modules for Fortran based on Arjen Markus' project,580,13,6,4
463,Fortran,bhermanmit,https://github.com/bhermanmit/Fortran,22.901 Fortran Class,4033,13,5,0
464,AtChem2,AtChem,https://github.com/AtChem/AtChem2,Atmospheric chemistry box-model for the MCM,5048,13,7,31
465,NHWAVE,JimKirby,https://github.com/JimKirby/NHWAVE,NHWAVE Developer Group and Software Distribution,42183,12,12,10
466,cgenie.muffin,derpycode,https://github.com/derpycode/cgenie.muffin,,71123,12,8,1
467,GLOW,NCAR,https://github.com/NCAR/GLOW,The GLobal airglOW Model,543,12,8,1
468,stringsort,jacobwilliams,https://github.com/jacobwilliams/stringsort,Just some sorting routines for strings,12,12,0,0
469,Tinker-HP,TinkerTools,https://github.com/TinkerTools/Tinker-HP,Tinker-HP: High Performance Massively Parallel Evolution of Tinker,94888,12,3,0
470,DART,NCAR,https://github.com/NCAR/DART,Data Assimilation Research Testbed,456030,12,12,2
471,Puffin,UKFELs,https://github.com/UKFELs/Puffin,3D unaveraged FEL simulation code,14845,12,10,27
472,IMEX_SfloW2D,demichie,https://github.com/demichie/IMEX_SfloW2D,Shallow water granular flow model,37120,12,3,4
473,scalapack,Reference-ScaLAPACK,https://github.com/Reference-ScaLAPACK/scalapack,ScaLAPACK development repository,2805,12,12,7
474,QTAdaptive,dattv,https://github.com/dattv/QTAdaptive,Quadtree Adaptive Mesh Refinement,56,12,8,1
475,fmmlib2d,zgimbutas,https://github.com/zgimbutas/fmmlib2d,Fast Multipole Method (FMM) library in R^2,4272,12,5,0
476,splf2003,pyccel,https://github.com/pyccel/splf2003,Fortran 2003 library for B-Splines/NURBS and Computer Aided Design Algorithms,696,12,3,0
477,ecalj,tkotani,https://github.com/tkotani/ecalj,The quasiparticle self-consistent GW method  in the PMT method (LAPW+LMTO+Lo). ,158798,12,15,0
478,slatec,Rufflewind,https://github.com/Rufflewind/slatec,SLATEC Common Mathematical Library,3228,12,6,0
479,V1,LBNL-AMO-MCTDHF,https://github.com/LBNL-AMO-MCTDHF/V1,LBNL-AMO-MCTDHF v1.36! . . . . . ,35236,12,3,13
480,Unstr3d---CFD-solver,wtffqbpl,https://github.com/wtffqbpl/Unstr3d---CFD-solver,An unstrctured 3-D Euler equation solver ( tetrahedral cell type),15,12,6,0
481,stda,grimme-lab,https://github.com/grimme-lab/stda,"stda program for computing excited states and response functions via simplified TD-DFT methods (sTDA, sTD-DFT, and SF-sTD-DFT)",580,12,4,1
482,Mie_scattering,cfinch,https://github.com/cfinch/Mie_scattering,Collection of codes to calculate scattering from spheres using the Mie solution,216,12,7,0
483,AMR-LBM-OpenMP-2D,AbbasHub,https://github.com/AbbasHub/AMR-LBM-OpenMP-2D,Adaptive Mesh Refinement (AMR) technique utilized with the Lattice-Boltzmann Method (LBM) for numerical simulation of multiphase flows. OpenMP is used for parallelization of the code on share-memory machines.,41,12,7,0
484,umwm,umwm,https://github.com/umwm/umwm,University of Miami Wave Model,827,12,2,1
485,sollve_vv,SOLLVE,https://github.com/SOLLVE/sollve_vv,"OpenMP Offloading Validation & Verification Suite; Official repository. We have migrated from bitbucket!! For documentation, results, publication and presentations, please check out our website ->",1025,12,4,35
486,Fortran-Expression-Evaluator,ivomarb,https://github.com/ivomarb/Fortran-Expression-Evaluator,An open source fortran expression evaluator (parser).,167,12,1,9
487,T-Blade3,GTSL-UC,https://github.com/GTSL-UC/T-Blade3,"T-Blade3 VERSION 1.2: T-Blade3 is a general parametric 3D blade geometry builder. The tool can create a variety of 3D blade geometries based on few basic parameters and limited interaction with a CAD system. The geometric and aerodynamic parameters are used to create 2D airfoils and these airfoils are stacked on the desired stacking axis. The tool generates a specified number of 2D blade sections in a 3D Cartesian coordinate system. The geometry modeler can also be used for generating 3D blades with special features like bent tip, split tip and other concepts, which can be explored with minimum changes to the blade geometry. The use of control points for the definition of splines makes it easy to modify the blade shapes quickly and smoothly to obtain the desired blade model. The second derivative of the mean-line (related to the curvature) is controlled using B-splines to create the airfoils. This is analytically integrated twice to obtain the mean-line. A smooth thickness distribution is then added to the airfoil with two options either the Wennerstrom distribution or a quartic B-spline thickness distribution. B-splines have also been implemented to achieve customized airfoil leading and trailing edges.",4339,12,6,0
488,IBFS-IF2D,atchieu,https://github.com/atchieu/IBFS-IF2D,Immersed boundary fractional step method written in FORTRAN 90,125,12,10,0
489,MissileSimulation,bgin,https://github.com/bgin/MissileSimulation,Air-to-Air Radar Guided Missile Modelling and Simulation Project,19897,13,1,0
490,open-fortran-parser-xml,mbdevpl,https://github.com/mbdevpl/open-fortran-parser-xml,"XML output generator for Open Fortran Parser, and Python wrapper for it.",642,12,2,0
491,forutils,cmbant,https://github.com/cmbant/forutils,Fortran 2008 utility functions and reusable classes,118,12,2,0
492,numfor,numericfor,https://github.com/numericfor/numfor,Numeric Modern Fortran,2937,12,1,0
493,NueralNets,arjo129,https://github.com/arjo129/NueralNets,Fortran Based Nueral Networks,47,12,1,0
494,lusol,nwh,https://github.com/nwh/lusol,Matlab interface to LUSOL,1198,12,3,2
495,FGPU,LLNL,https://github.com/LLNL/FGPU,,95,12,5,0
496,nswc,jacobwilliams,https://github.com/jacobwilliams/nswc,NSWC Mathematics Subroutine Library,37808,12,4,0
497,piclas,piclas-framework,https://github.com/piclas-framework/piclas,"PICLas is a parallel, three-dimensional PIC-DSMC solver developed cooperatively by the Institute of Space Systems, Institute of Aerodynamics and Gas Dynamics at the University of Stuttgart and the spin-off boltzplatz. PICLas is a flexible particle-based plasma simulation suite.",210503,12,4,0
498,finite-fault,usgs,https://github.com/usgs/finite-fault,Finite-Fault Modeling of the Earthquake Source using Teleseismic Body Waves,72906,12,12,3
499,Textbook-FEM,jvleta,https://github.com/jvleta/Textbook-FEM,,626,12,12,0
500,ZstdFortranLib,zbeekman,https://github.com/zbeekman/ZstdFortranLib,👨‍💻Zaak's 🧩(missing) 🏛Standard 🔬Fortran 📚Library 🚧(WIP),271,12,0,0
501,seagrid,sea-mat,https://github.com/sea-mat/seagrid,Orthogonal curvilinear grid creator for Matlab,2019,12,12,1
502,wavy,wavebitscientific,https://github.com/wavebitscientific/wavy,A spectral ocean wave modeling framework,1207,12,3,4
503,paleoToolkit,CESM-Development,https://github.com/CESM-Development/paleoToolkit,paleo tools for cesm,204318,12,11,1
504,aces4,UFParLab,https://github.com/UFParLab/aces4,Parallel Computational Chemistry Application,27282,12,11,3
505,qtcm,jwblin,https://github.com/jwblin/qtcm,A Python Implementation of the Neelin-Zeng QTCM1,56728,12,4,0
506,tristan-mp-pitp,ntoles,https://github.com/ntoles/tristan-mp-pitp,Particle-in-cell code TRISTAN-MP,1037,12,18,0
507,atmos,VirtualPlanetaryLaboratory,https://github.com/VirtualPlanetaryLaboratory/atmos,,18184,12,6,3
508,futility,cmacmackin,https://github.com/cmacmackin/futility,A collection of modern Fortran utilities,117,11,1,2
509,Octopus,jinbow,https://github.com/jinbow/Octopus,Offline calculation of particle trajectories,166,11,3,0
510,B5500-software,retro-software,https://github.com/retro-software/B5500-software,Common source code repository for emulators of the Burroughs B5500 computer system.,17246,11,2,0
511,MoDeNa,MoDeNa-EUProject,https://github.com/MoDeNa-EUProject/MoDeNa,Software Framework for MOdelling of morphology DEvelopment of micro- and NAnostructures (MoDeNa),40560,11,17,7
512,HydroBlocks,chaneyn,https://github.com/chaneyn/HydroBlocks,,275715,11,6,2
513,pd-abstractions-and-libraries,gilbertohasnofb,https://github.com/gilbertohasnofb/pd-abstractions-and-libraries,,4587,11,0,0
514,mld2p4-2,sfilippone,https://github.com/sfilippone/mld2p4-2,,12450,11,6,0
515,DAzimSurfTomo,Chuanming-Liu,https://github.com/Chuanming-Liu/DAzimSurfTomo,Direct inversion of Rayleigh wave dispersion data for 3-D azimuthal anisotropy based on ray tracing,57718,11,11,0
516,C2-Ray3Dm,garrelt,https://github.com/garrelt/C2-Ray3Dm,"The 3D version of C2-Ray for multiple sources, hydrogen only",1483,11,3,3
517,Periodic_NBO,Chengcheng-Xiao,https://github.com/Chengcheng-Xiao/Periodic_NBO,Natural Bond Orbital algorithm to handle systems characterized by periodic symmetry,149,11,5,0
518,ptools,ptools,https://github.com/ptools/ptools,,12896,11,12,37
519,mizuRoute,NCAR,https://github.com/NCAR/mizuRoute,Stand-alone streamflow routing model,28872,11,22,5
520,fortran_hash_table,pdebuyl,https://github.com/pdebuyl/fortran_hash_table,"""<string,string>"" hash table in Fortran 2008",178,11,1,0
521,neutran,m87,https://github.com/m87/neutran,Backpropagation neural network in Fortran 90/95,40,11,3,0
522,BSAM1.2,BSAM,https://github.com/BSAM/BSAM1.2,Version 1.2,64,11,4,0
523,flibs,philip-peterson,https://github.com/philip-peterson/flibs,"Fortran libraries (written by other people, I am merely forking)",1013,11,5,0
524,MuSTEM,HamishGBrown,https://github.com/HamishGBrown/MuSTEM,"Open source version of the MuSTEM multislice electron microscopy simulation code, developed at the University of Melbourne.",207404,11,11,15
525,FOSSIL,szaghi,https://github.com/szaghi/FOSSIL,"FOSSIL, FOrtran Stereo (si) Litography parser",3879,11,2,2
526,amica,japalmer29,https://github.com/japalmer29/amica,Code for AMICA: Adaptive Mixture ICA with shared components,31400,11,2,15
